{
  "systems":[
    {
      "name":"dotCMS 5.2.7",
      "date":"2021-07-14 18:53:09.18862463 +0000 UTC m=+641.919624176"
    }
  ],
  "dependencies":{
  },
  "definition":{
    "id":[
      {
        "value":"9727c4e6-786c-4b20-b581-0a3ea1bb38d4"
      }
    ],
    "properties":{
      "type":"File",
      "uniqueName":"Image",
      "name":"Image",
      "parent":{
        "type":"Site",
        "id":[
          {
            "value":"8a7d5e23-da1e-420a-b4f0-471e7da8ea2d"
          }
        ]
      },
      "system":{
        "default_structure":"false",
        "fixed":"false",
        "folder":"SYSTEM_FOLDER",
        "system":"false"
      },
      "modificationDate":"2021-07-14 18:43:48 +0000 UTC"
    },
    "fields":[
      {
        "id":[
          {
            "value":"80a8ba12-e69d-4f23-8a97-40c3cb136927"
          }
        ],
        "properties":{
          "dataType":"String",
          "fieldType":"Site",
          "validations":[
            {
              "required":true
            }
          ],
          "constraints":[
            {
              "unique":false
            },
            {
              "readOnly":false
            },
            {
              "fixed":true
            }
          ],
          "display":[
            {
              "searchable":true
            },
            {
              "showInList":false
            }
          ],
          "system":{
            "field_contentlet":"system_field",
            "indexed":"true"
          },
          "order":0,
          "uniqueName":"hostFolder",
          "name":"Site or Folder",
          "modificationDate":"2021-07-14 18:43:47 +0000 UTC"
        }
      },
      {
        "id":[
          {
            "value":"8c6ad292-547e-4d27-9552-c9ad49ad0bca"
          }
        ],
        "properties":{
          "dataType":"String",
          "fieldType":"Binary",
          "validations":[
            {
              "required":true
            }
          ],
          "constraints":[
            {
              "unique":false
            },
            {
              "readOnly":false
            },
            {
              "fixed":true
            }
          ],
          "display":[
            {
              "searchable":true
            },
            {
              "showInList":false
            }
          ],
          "system":{
            "field_contentlet":"system_field",
            "indexed":"true"
          },
          "order":1,
          "uniqueName":"fileAsset",
          "name":"File Asset",
          "modificationDate":"2021-07-14 18:43:47 +0000 UTC"
        }
      },
      {
        "id":[
          {
            "value":"6a582bf1-bfee-4964-b903-a34699f231a9"
          }
        ],
        "properties":{
          "dataType":"String",
          "fieldType":"Text",
          "validations":[
            {
              "required":true
            }
          ],
          "constraints":[
            {
              "unique":false
            },
            {
              "readOnly":false
            },
            {
              "fixed":true
            }
          ],
          "display":[
            {
              "searchable":true
            },
            {
              "showInList":false
            }
          ],
          "system":{
            "field_contentlet":"text1",
            "indexed":"true"
          },
          "order":2,
          "uniqueName":"title",
          "name":"Title",
          "modificationDate":"2021-07-14 18:43:48 +0000 UTC"
        }
      },
      {
        "id":[
          {
            "value":"6a859c54-11fb-4be7-bb41-ec07e5f56f3d"
          }
        ],
        "properties":{
          "dataType":"String",
          "fieldType":"Text",
          "validations":[
            {
              "required":false
            }
          ],
          "constraints":[
            {
              "unique":false
            },
            {
              "readOnly":false
            },
            {
              "fixed":true
            }
          ],
          "display":[
            {
              "searchable":true
            },
            {
              "showInList":true
            }
          ],
          "system":{
            "field_contentlet":"text2",
            "indexed":"true"
          },
          "order":3,
          "uniqueName":"fileName",
          "name":"File Name",
          "modificationDate":"2021-07-14 18:43:48 +0000 UTC"
        }
      },
      {
        "id":[
          {
            "value":"8da9a418-87d0-4aee-a401-ae7be926715e"
          }
        ],
        "properties":{
          "dataType":"String",
          "fieldType":"Tab",
          "validations":[
            {
              "required":false
            }
          ],
          "constraints":[
            {
              "unique":false
            },
            {
              "readOnly":false
            },
            {
              "fixed":false
            }
          ],
          "display":[
            {
              "searchable":false
            },
            {
              "showInList":false
            }
          ],
          "system":{
            "field_contentlet":"system_field",
            "indexed":"false"
          },
          "order":4,
          "uniqueName":"metadataTab",
          "name":"Metadata",
          "modificationDate":"2021-07-14 18:43:48 +0000 UTC"
        }
      },
      {
        "id":[
          {
            "value":"64e7ad1d-6539-4721-be7d-0b6027be5259"
          }
        ],
        "properties":{
          "dataType":"BigString",
          "fieldType":"KeyValue",
          "validations":[
            {
              "required":false
            }
          ],
          "constraints":[
            {
              "unique":false
            },
            {
              "readOnly":true
            },
            {
              "fixed":true
            }
          ],
          "display":[
            {
              "searchable":true
            },
            {
              "showInList":false
            }
          ],
          "system":{
            "field_contentlet":"text_area1",
            "indexed":"true"
          },
          "order":5,
          "uniqueName":"metaData",
          "name":"Metadata",
          "modificationDate":"2021-07-14 18:43:48 +0000 UTC"
        }
      },
      {
        "id":[
          {
            "value":"288e1d7a-1fad-407b-859c-384ba312af27"
          }
        ],
        "properties":{
          "dataType":"String",
          "fieldType":"Checkbox",
          "validations":[
            {
              "required":false
            }
          ],
          "constraints":[
            {
              "unique":false
            },
            {
              "readOnly":false
            },
            {
              "fixed":true
            }
          ],
          "display":[
            {
              "searchable":false
            },
            {
              "showInList":false
            }
          ],
          "system":{
            "field_contentlet":"text3",
            "indexed":"true"
          },
          "order":6,
          "uniqueName":"showOnMenu",
          "setUpData":"|true",
          "name":"Show on Menu",
          "defaultValue":"false",
          "modificationDate":"2021-07-14 18:43:48 +0000 UTC"
        }
      },
      {
        "id":[
          {
            "value":"0a50eb4b-2073-4ae2-82fc-ab2a046d7e91"
          }
        ],
        "properties":{
          "dataType":"Int",
          "fieldType":"Text",
          "validations":[
            {
              "required":false
            }
          ],
          "constraints":[
            {
              "unique":false
            },
            {
              "readOnly":false
            },
            {
              "fixed":true
            }
          ],
          "display":[
            {
              "searchable":true
            },
            {
              "showInList":false
            }
          ],
          "system":{
            "field_contentlet":"integer1",
            "indexed":"true"
          },
          "order":7,
          "uniqueName":"sortOrder",
          "name":"Sort Order",
          "defaultValue":"0",
          "modificationDate":"2021-07-14 18:43:48 +0000 UTC"
        }
      },
      {
        "id":[
          {
            "value":"512503af-cb80-46ce-b12e-26135e7ea3aa"
          }
        ],
        "properties":{
          "dataType":"BigString",
          "fieldType":"Textarea",
          "validations":[
            {
              "required":false
            }
          ],
          "constraints":[
            {
              "unique":false
            },
            {
              "readOnly":false
            },
            {
              "fixed":true
            }
          ],
          "display":[
            {
              "searchable":false
            },
            {
              "showInList":false
            }
          ],
          "system":{
            "field_contentlet":"text_area2",
            "indexed":"true"
          },
          "order":8,
          "uniqueName":"description",
          "name":"Description",
          "modificationDate":"2021-07-14 18:43:48 +0000 UTC"
        }
      }
    ]
  },
  "contents":[
    {
      "id":[
        {
          "value":"ed88ee7d-5edb-4918-9891-43d91697c261"
        }
      ],
      "properties":{
        "type":"Content",
        "status":"Live",
        "languageId":[
          {
            "value":"1"
          }
        ],
        "definitionId":[
          {
            "value":"9727c4e6-786c-4b20-b581-0a3ea1bb38d4"
          }
        ],
        "name":"img1.jpg",
        "path":"/Documents/",
        "site":"b91f2b4b-ac64-429e-8a58-5c3f8484a600",
        "system":{
        }
      },
      "versions":[
        {
          "id":[
            {